{
  "procedure": {
    "doc_id": "niosh_nmam_5th_edition_ebook",
    "title": "NIOSH organo-arsenic sampling method excerpt",
    "version": "NMAM 5th Edition Method 5022",
    "domain": "industrial_hygiene_sampling",
    "source": {
      "doc_id": "niosh_nmam_5th_edition_ebook",
      "page": "Method 5022",
      "section": "SAMPLING and SAMPLE PREPARATION"
    },
    "audit": {
      "gold_status": "pilot_gold",
      "annotation_status": "double_annotated",
      "annotation_scope": "bounded_excerpt",
      "annotator_count": 1,
      "guideline_version": "ipke-annotation-guideline-v0.1-pilot",
      "model_draft_used": true,
      "reviewed_by": "paper-author-self-review",
      "reviewed_at": "2026-06-06",
      "review_notes": "Pilot annotation produced from model draft, then self-corrected. Not yet independently annotated. See datasets/paper/annotation_batches/."
    }
  },
  "steps": [
    {
      "id": "S1",
      "label": "Calibrate each personal sampling pump with a representative sampler in line",
      "action_verb": "calibrate",
      "action_object": "personal sampling pump",
      "arguments": [],
      "parameters": [],
      "constraints": [],
      "flags": {
        "safety_critical": true
      },
      "provenance": {
        "doc_id": "niosh_nmam_5th_edition_ebook",
        "section": "Method 5022 Sampling 1"
      }
    },
    {
      "id": "S2",
      "label": "Sample at a known flow rate between 1 and 3 liters per minute for a total volume of 50 to 1000 liters",
      "action_verb": "sample",
      "action_object": "air sample",
      "arguments": [],
      "parameters": [
        {
          "name": "flow_rate",
          "value": "1-3 L/min"
        },
        {
          "name": "sample_volume",
          "value": "50-1000 L"
        }
      ],
      "constraints": [],
      "flags": {
        "safety_critical": true
      },
      "provenance": {
        "doc_id": "niosh_nmam_5th_edition_ebook",
        "section": "Method 5022 Sampling 2"
      }
    },
    {
      "id": "S3",
      "label": "Cap the cassettes and pack them securely for shipment",
      "action_verb": "pack",
      "action_object": "sample cassettes",
      "arguments": [],
      "parameters": [],
      "constraints": [],
      "flags": {
        "safety_critical": true
      },
      "provenance": {
        "doc_id": "niosh_nmam_5th_edition_ebook",
        "section": "Method 5022 Sampling 3"
      }
    },
    {
      "id": "S4",
      "label": "Pipet 25 milliliters of eluent into a clean 50 milliliter beaker for each sample",
      "action_verb": "pipet",
      "action_object": "eluent into beaker",
      "arguments": [],
      "parameters": [
        {
          "name": "eluent_volume",
          "value": "25 mL"
        }
      ],
      "constraints": [],
      "flags": {
        "safety_critical": true
      },
      "provenance": {
        "doc_id": "niosh_nmam_5th_edition_ebook",
        "section": "Method 5022 Sample Preparation 4"
      }
    },
    {
      "id": "S5",
      "label": "Transfer the PTFE filter to the beaker with the exposed side in contact with the solution",
      "action_verb": "transfer",
      "action_object": "PTFE filter",
      "arguments": [],
      "parameters": [],
      "constraints": [
        {
          "id": "C1",
          "type": "warning",
          "text": "Wear gloves, lab coat, and safety glasses while handling the chemicals.",
          "attached_to": [
            "S5"
          ]
        }
      ],
      "flags": {
        "safety_critical": true
      },
      "provenance": {
        "doc_id": "niosh_nmam_5th_edition_ebook",
        "section": "Method 5022 Sample Preparation 5"
      }
    },
    {
      "id": "S6",
      "label": "Agitate the beaker in an ultrasonic water bath for 30 minutes",
      "action_verb": "agitate",
      "action_object": "sample beaker",
      "arguments": [],
      "parameters": [
        {
          "name": "agitation_time",
          "value": "30 min"
        }
      ],
      "constraints": [
        {
          "id": "C2",
          "type": "storage",
          "text": "Store the extracts at about 4 degrees Celsius if they are not analyzed immediately.",
          "attached_to": [
            "S6"
          ]
        }
      ],
      "flags": {
        "safety_critical": true
      },
      "provenance": {
        "doc_id": "niosh_nmam_5th_edition_ebook",
        "section": "Method 5022 Sample Preparation 6"
      }
    }
  ],
  "constraints": [],
  "relations": [],
  "quality": {
    "annotation_scope": "bounded_excerpt",
    "review_status": "reviewed"
  }
}
