{
  "procedure": {
    "doc_id": "niosh_nmam_5th_edition_ebook",
    "title": "NIOSH organo-arsenic sampling method excerpt (second pass)",
    "version": "NMAM 5th Edition Method 5022",
    "domain": "industrial_hygiene_sampling",
    "source": {
      "doc_id": "niosh_nmam_5th_edition_ebook",
      "page": "Method 5022",
      "section": "SAMPLING and SAMPLE PREPARATION"
    },
    "audit": {
      "gold_status": "pilot_gold",
      "annotation_status": "double_annotated",
      "annotation_scope": "bounded_excerpt",
      "annotator_count": 2,
      "guideline_version": "ipke-annotation-guideline-v0.1-pilot",
      "model_draft_used": true,
      "reviewed_by": "batch_pilot_second_pass",
      "reviewed_at": "2026-06-06",
      "review_notes": "Pilot second-pass annotation produced from model draft, then self-corrected. See datasets/paper/annotation_batches/."
    }
  },
  "steps": [
    {
      "id": "S1",
      "label": "Calibrate each personal sampling pump with a representative sampler in line",
      "action_verb": "calibrate",
      "action_object": "personal sampling pump",
      "arguments": [],
      "parameters": [],
      "constraints": [],
      "flags": {
        "safety_critical": true
      },
      "provenance": {
        "doc_id": "niosh_nmam_5th_edition_ebook",
        "section": "Method 5022 Sampling 1"
      }
    },
    {
      "id": "S2",
      "label": "Sample at a flow rate of 1 to 3 liters per minute to collect 50 to 1000 liters total",
      "action_verb": "sample",
      "action_object": "air sample",
      "arguments": [],
      "parameters": [
        {
          "name": "flow_rate",
          "value": "1-3 L/min"
        },
        {
          "name": "sample_volume",
          "value": "50-1000 L"
        }
      ],
      "constraints": [],
      "flags": {
        "safety_critical": true
      },
      "provenance": {
        "doc_id": "niosh_nmam_5th_edition_ebook",
        "section": "Method 5022 Sampling 2"
      }
    },
    {
      "id": "S3",
      "label": "Cap the sample cassettes and pack them securely for shipment",
      "action_verb": "cap",
      "action_object": "sample cassettes",
      "arguments": [],
      "parameters": [],
      "constraints": [],
      "flags": {
        "safety_critical": true
      },
      "provenance": {
        "doc_id": "niosh_nmam_5th_edition_ebook",
        "section": "Method 5022 Sampling 3"
      }
    },
    {
      "id": "S4",
      "label": "Pipet 25 milliliters of eluent into a clean 50 milliliter beaker for each sample",
      "action_verb": "pipet",
      "action_object": "eluent into beaker",
      "arguments": [],
      "parameters": [
        {
          "name": "eluent_volume",
          "value": "25 mL"
        }
      ],
      "constraints": [
        {
          "id": "C1",
          "type": "warning",
          "text": "Wear gloves, lab coat, and safety glasses while handling the chemicals.",
          "attached_to": [
            "S4"
          ]
        }
      ],
      "flags": {
        "safety_critical": true
      },
      "provenance": {
        "doc_id": "niosh_nmam_5th_edition_ebook",
        "section": "Method 5022 Sample Preparation 4"
      }
    }
  ],
  "constraints": [],
  "relations": [],
  "quality": {
    "annotation_scope": "bounded_excerpt",
    "review_status": "reviewed"
  }
}
